phone,GuideName,area,Seniority,trip_price,about_you
0501234567,יהונתן סמית,מרכז,5,300,אני הוא מורה הדרכה באזור המרכז כבר 5 שנים ואני אוהב להראות לאורחים את החפצים הנסתרים של האזור.
0501234568,גיין דוא,גליל עליון,10,250,"עם יותר מ-10 שנים של ניסיון כמורה הדרכה בגליל עליון, אני יודע את כל המסלולים המטיילים הכי טובים והנקודות הכי כדאי לראות."
0501234569,מיכאל ג ונסון,גליל תחתון,3,200,"כמורה הדרכה חדשה בגליל תחתון, אני מתרגש להראות לאורחים את היופי של האזור ואת כל מה שהוא יש להציע."
0501234570,אמילי בראון,כנרת,8,350,אני הוא מורה הדרכה באזור כנרת כבר 8 שנים ואני מכיר המון מידע על ההיסטוריה והתרבות של האזור.
0501234571,יעקב דאוויס,ערבה,7,400,אני הוא מורה הדרכה
8888888888,fdfsdf,ערבה,2,2,ffdsffds
